Key,Item Type,Publication Year,Author,Title,Publication Title,ISBN,ISSN,DOI,Url,Abstract Note,Date,Date Added,Date Modified,Access Date,Pages,Num Pages,Issue,Volume,Number Of Volumes,Journal Abbreviation,Short Title,Series,Series Number,Series Text,Series Title,Publisher,Place,Language,Rights,Type,Archive,Archive Location,Library Catalog,Call Number,Extra,Notes,File Attachments,Link Attachments,Manual Tags,Automatic Tags,Editor,Series Editor,Translator,Contributor,Attorney Agent,Book Author,Cast Member,Commenter,Composer,Cosponsor,Counsel,Interviewer,Producer,Recipient,Reviewed Author,Scriptwriter,Words By,Guest,Number,Edition,Running Time,Scale,Medium,Artwork Size,Filing Date,Application Number,Assignee,Issuing Authority,Country,Meeting Name,Conference Name,Court,References,Reporter,Legal Status,Priority Numbers,Programming Language,Version,System,Code,Code Number,Section,Session,Committee,History,Legislative Body
3LHYWXVP,conferencePaper,2019,"Raff, Edward; Sylvester, Jared; Forsyth, Steven; McLean, Mark",Barrage of Random Transforms for Adversarially Robust Defense,2019 IEEE/CVF Conference on Computer Vision and Pattern Recognition (CVPR),978-1-72813-293-8,,10.1109/CVPR.2019.00669,https://ieeexplore.ieee.org/document/8954476/,"Defenses against adversarial examples, when using the ImageNet dataset, are historically easy to defeat. The common understanding is that a combination of simple image transformations and other various defenses are insuﬃcient to provide the necessary protection when the obfuscated gradient is taken into account. In this paper, we explore the idea of stochastically combining a large number of individually weak defenses into a single barrage of randomized transformations to build a strong defense against adversarial attacks. We show that, even after accounting for obfuscated gradients, the Barrage of Random Transforms (BaRT) is a resilient defense against even the most diﬃcult attacks, such as PGD. BaRT achieves up to a 24⇥ improvement in accuracy compared to previous work, and has even extended eﬀectiveness out to a previously untested maximum adversarial perturbation of ✏ = 32.",Jun-19,2020/7/19 6:57,2020/7/19 6:57,2020/7/19 6:57,6521-6530,,,,,,,,,,,IEEE,"Long Beach, CA, USA",en,,,,,DOI.org (Crossref),,,,C:\Users\zhbli\Zotero\storage\AIADLRG4\Raff 等。 - 2019 - Barrage of Random Transforms for Adversarially Rob.pdf,,,,,,,,,,,,,,,,,,,,,,,,,,,,,,,,,,2019 IEEE/CVF Conference on Computer Vision and Pattern Recognition (CVPR),,,,,,,,,,,,,,,
QHWKC92P,conferencePaper,2019,"Ho, Chih-Hui; Leung, Brandon; Sandstrom, Erik; Chang, Yen; Vasconcelos, Nuno","Catastrophic Child's Play: Easy to Perform, Hard to Defend Adversarial Attacks",2019 IEEE/CVF Conference on Computer Vision and Pattern Recognition (CVPR),978-1-72813-293-8,,10.1109/CVPR.2019.00945,https://ieeexplore.ieee.org/document/8954169/,"The problem of adversarial CNN attacks is considered, with an emphasis on attacks that are trivial to perform but difﬁcult to defend. A framework for the study of such attacks is proposed, using real world object manipulations. Unlike most works in the past, this framework supports the design of attacks based on both small and large image perturbations, implemented by camera shake and pose variation. A setup is proposed for the collection of such perturbations and determination of their perceptibility. It is argued that perceptibility depends on context, and a distinction is made between imperceptible and semantically imperceptible perturbations. While the former survives image comparisons, the latter are perceptible but have no impact on human object recognition. A procedure is proposed to determine the perceptibility of perturbations using Turk experiments, and a dataset of both perturbation classes which enables replicable studies of object manipulation attacks, is assembled. Experiments using defenses based on many datasets, CNN models, and algorithms from the literature elucidate the difﬁculty of defending these attacks – in fact, none of the existing defenses is found effective against them. Better results are achieved with real world data augmentation, but even this is not foolproof. These results conﬁrm the hypothesis that current CNNs are vulnerable to attacks implementable even by a child, and that such attacks may prove difﬁcult to defend.",Jun-19,2020/7/19 6:58,2020/7/19 6:58,2020/7/19 6:58,9221-9229,,,,,,Catastrophic Child's Play,,,,,IEEE,"Long Beach, CA, USA",en,,,,,DOI.org (Crossref),,,,"C:\Users\zhbli\Zotero\storage\YFGTW2S5\Ho 等。 - 2019 - Catastrophic Child's Play Easy to Perform, Hard t.pdf",,,,,,,,,,,,,,,,,,,,,,,,,,,,,,,,,,2019 IEEE/CVF Conference on Computer Vision and Pattern Recognition (CVPR),,,,,,,,,,,,,,,
QAR6QPEM,conferencePaper,2019,"Jia, Xiaojun; Wei, Xingxing; Cao, Xiaochun; Foroosh, Hassan",ComDefend: An Efficient Image Compression Model to Defend Adversarial Examples,2019 IEEE/CVF Conference on Computer Vision and Pattern Recognition (CVPR),978-1-72813-293-8,,10.1109/CVPR.2019.00624,https://ieeexplore.ieee.org/document/8954282/,"Deep neural networks (DNNs) have been demonstrated to be vulnerable to adversarial examples. Speciﬁcally, adding imperceptible perturbations to clean images can fool the well trained deep neural networks. In this paper, we propose an end-to-end image compression model to defend adversarial examples: ComDefend. The proposed model consists of a compression convolutional neural network (ComCNN) and a reconstruction convolutional neural network (RecCNN). The ComCNN is used to maintain the structure information of the original image and purify adversarial perturbations. And the RecCNN is used to reconstruct the original image with high quality. In other words, ComDefend can transform the adversarial image to its clean version, which is then fed to the trained classiﬁer. Our method is a pre-processing module, and does not modify the classiﬁer’s structure during the whole process. Therefore, it can be combined with other model-speciﬁc defense models to jointly improve the classiﬁer’s robustness. A series of experiments conducted on MNIST, CIFAR10 and ImageNet show that the proposed method outperforms the state-of-the-art defense methods, and is consistently effective to protect classiﬁers against adversarial attacks.",Jun-19,2020/7/19 7:00,2020/7/19 7:00,2020/7/19 7:00,6077-6085,,,,,,ComDefend,,,,,IEEE,"Long Beach, CA, USA",en,,,,,DOI.org (Crossref),,,,C:\Users\zhbli\Zotero\storage\FZWH5EU2\Jia 等。 - 2019 - ComDefend An Efficient Image Compression Model to.pdf,,,,,,,,,,,,,,,,,,,,,,,,,,,,,,,,,,2019 IEEE/CVF Conference on Computer Vision and Pattern Recognition (CVPR),,,,,,,,,,,,,,,
MLVFNMKE,conferencePaper,2019,"Shi, Yucheng; Wang, Siyu; Han, Yahong",Curls & Whey: Boosting Black-Box Adversarial Attacks,2019 IEEE/CVF Conference on Computer Vision and Pattern Recognition (CVPR),978-1-72813-293-8,,10.1109/CVPR.2019.00668,https://ieeexplore.ieee.org/document/8953945/,"Image classiﬁers based on deep neural networks suffer from harassment caused by adversarial examples. Two defects exist in black-box iterative attacks that generate adversarial examples by incrementally adjusting the noiseadding direction for each step. On the one hand, existing iterative attacks add noises monotonically along the direction of gradient ascent, resulting in a lack of diversity and adaptability of the generated iterative trajectories. On the other hand, it is trivial to perform adversarial attack by adding excessive noises, but currently there is no reﬁnement mechanism to squeeze redundant noises. In this work, we propose Curls & Whey black-box attack to ﬁx the above two defects. During Curls iteration, by combining gradient ascent and descent, we ‘curl’ up iterative trajectories to integrate more diversity and transferability into adversarial examples. Curls iteration also alleviates the diminishing marginal effect in existing iterative attacks. The Whey optimization further squeezes the ‘whey’ of noises by exploiting the robustness of adversarial perturbation. Extensive experiments on Imagenet and Tiny-Imagenet demonstrate that our approach achieves impressive decrease on noise magnitude in ℓ2 norm. Curls & Whey attack also shows promising transferability against ensemble models as well as adversarially trained models. In addition, we extend our attack to the targeted misclassiﬁcation, effectively reducing the difﬁculty of targeted attacks under black-box condition.",Jun-19,2020/7/19 7:02,2020/7/19 7:02,2020/7/19 7:02,6512-6520,,,,,,Curls & Whey,,,,,IEEE,"Long Beach, CA, USA",en,,,,,DOI.org (Crossref),,,,C:\Users\zhbli\Zotero\storage\TJPNCSJP\Shi 等。 - 2019 - Curls & Whey Boosting Black-Box Adversarial Attac.pdf,,,,,,,,,,,,,,,,,,,,,,,,,,,,,,,,,,2019 IEEE/CVF Conference on Computer Vision and Pattern Recognition (CVPR),,,,,,,,,,,,,,,
C5LEBNYA,conferencePaper,2019,"Rony, Jerome; Hafemann, Luiz G.; Oliveira, Luiz S.; Ben Ayed, Ismail; Sabourin, Robert; Granger, Eric",Decoupling Direction and Norm for Efficient Gradient-Based L2 Adversarial Attacks and Defenses,2019 IEEE/CVF Conference on Computer Vision and Pattern Recognition (CVPR),978-1-72813-293-8,,10.1109/CVPR.2019.00445,https://ieeexplore.ieee.org/document/8954314/,"Research on adversarial examples in computer vision tasks has shown that small, often imperceptible changes to an image can induce misclassiﬁcation, which has security implications for a wide range of image processing systems. Considering L2 norm distortions, the Carlini and Wagner attack is presently the most effective white-box attack in the literature. However, this method is slow since it performs a line-search for one of the optimization terms, and often requires thousands of iterations. In this paper, an efﬁcient approach is proposed to generate gradient-based attacks that induce misclassiﬁcations with low L2 norm, by decoupling the direction and the norm of the adversarial perturbation that is added to the image. Experiments conducted on the MNIST, CIFAR-10 and ImageNet datasets indicate that our attack achieves comparable results to the state-of-the-art (in terms of L2 norm) with considerably fewer iterations (as few as 100 iterations), which opens the possibility of using these attacks for adversarial training. Models trained with our attack achieve state-of-the-art robustness against whitebox gradient-based L2 attacks on the MNIST and CIFAR-10 datasets, outperforming the Madry defense when the attacks are limited to a maximum norm.",Jun-19,2020/7/19 7:03,2020/7/19 7:03,2020/7/19 7:03,4317-4325,,,,,,,,,,,IEEE,"Long Beach, CA, USA",en,,,,,DOI.org (Crossref),,,,C:\Users\zhbli\Zotero\storage\HDC5Z26A\Rony 等。 - 2019 - Decoupling Direction and Norm for Efficient Gradie.pdf,,,,,,,,,,,,,,,,,,,,,,,,,,,,,,,,,,2019 IEEE/CVF Conference on Computer Vision and Pattern Recognition (CVPR),,,,,,,,,,,,,,,
DG6S9EI9,conferencePaper,2019,"Liu, Yaojie; Stehouwer, Joel; Jourabloo, Amin; Liu, Xiaoming",Deep Tree Learning for Zero-Shot Face Anti-Spoofing,2019 IEEE/CVF Conference on Computer Vision and Pattern Recognition (CVPR),978-1-72813-293-8,,10.1109/CVPR.2019.00481,https://ieeexplore.ieee.org/document/8953776/,"Face anti-spooﬁng is designed to prevent face recognition systems from recognizing fake faces as the genuine users. While advanced face anti-spooﬁng methods are developed, new types of spoof attacks are also being created and becoming a threat to all existing systems. We deﬁne the detection of unknown spoof attacks as Zero-Shot Face Anti-spooﬁng (ZSFA). Previous ZSFA works only study 12 types of spoof attacks, such as print/replay, which limits the insight of this problem. In this work, we investigate the ZSFA problem in a wide range of 13 types of spoof attacks, including print, replay, 3D mask, and so on. A novel Deep Tree Network (DTN) is proposed to partition the spoof samples into semantic sub-groups in an unsupervised fashion. When a data sample arrives, being know or unknown attacks, DTN routes it to the most similar spoof cluster, and makes the binary decision. In addition, to enable the study of ZSFA, we introduce the ﬁrst face anti-spooﬁng database that contains diverse types of spoof attacks. Experiments show that our proposed method achieves the state of the art on multiple testing protocols of ZSFA.",Jun-19,2020/7/19 7:04,2020/7/19 7:04,2020/7/19 7:04,4675-4684,,,,,,,,,,,IEEE,"Long Beach, CA, USA",en,,,,,DOI.org (Crossref),,,,C:\Users\zhbli\Zotero\storage\J46FT2HQ\Liu 等。 - 2019 - Deep Tree Learning for Zero-Shot Face Anti-Spoofin.pdf,,,,,,,,,,,,,,,,,,,,,,,,,,,,,,,,,,2019 IEEE/CVF Conference on Computer Vision and Pattern Recognition (CVPR),,,,,,,,,,,,,,,
QNHRUPBG,conferencePaper,2019,"Taran, Olga; Rezaeifar, Shideh; Holotyak, Taras; Voloshynovskiy, Slava",Defending Against Adversarial Attacks by Randomized Diversification,2019 IEEE/CVF Conference on Computer Vision and Pattern Recognition (CVPR),978-1-72813-293-8,,10.1109/CVPR.2019.01148,https://ieeexplore.ieee.org/document/8953443/,"The vulnerability of machine learning systems to adversarial attacks questions their usage in many applications. In this paper, we propose a randomized diversiﬁcation as a defense strategy. We introduce a multi-channel architecture in a gray-box scenario, which assumes that the architecture of the classiﬁer and the training data set are known to the attacker. The attacker does not only have access to a secret key and to the internal states of the system at the test time. The defender processes an input in multiple channels. Each channel introduces its own randomization in a special transform domain based on a secret key shared between the training and testing stages. Such a transform based randomization with a shared key preserves the gradients in key-deﬁned sub-spaces for the defender but it prevents gradient back propagation and the creation of various bypass systems for the attacker. An additional beneﬁt of multi-channel randomization is the aggregation that fuses soft-outputs from all channels, thus increasing the reliability of the ﬁnal score. The sharing of a secret key creates an information advantage to the defender. Experimental evaluation demonstrates an increased robustness of the proposed method to a number of known state-of-the-art attacks.",Jun-19,2020/7/19 7:05,2020/7/19 7:05,2020/7/19 7:05,11218-11225,,,,,,,,,,,IEEE,"Long Beach, CA, USA",en,,,,,DOI.org (Crossref),,,,C:\Users\zhbli\Zotero\storage\WIGT7XZM\Taran 等。 - 2019 - Defending Against Adversarial Attacks by Randomize.pdf,,,,,,,,,,,,,,,,,,,,,,,,,,,,,,,,,,2019 IEEE/CVF Conference on Computer Vision and Pattern Recognition (CVPR),,,,,,,,,,,,,,,
BSQP28NF,conferencePaper,2019,"Dubey, Abhimanyu; Maaten, Laurens van der; Yalniz, Zeki; Li, Yixuan; Mahajan, Dhruv",Defense Against Adversarial Images Using Web-Scale Nearest-Neighbor Search,2019 IEEE/CVF Conference on Computer Vision and Pattern Recognition (CVPR),978-1-72813-293-8,,10.1109/CVPR.2019.00897,https://ieeexplore.ieee.org/document/8954397/,"A plethora of recent work has shown that convolutional networks are not robust to adversarial images: images that are created by perturbing a sample from the data distribution as to maximize the loss on the perturbed example. In this work, we hypothesize that adversarial perturbations move the image away from the image manifold in the sense that there exists no physical process that could have produced the adversarial image. This hypothesis suggests that a successful defense mechanism against adversarial images should aim to project the images back onto the image manifold. We study such defense mechanisms, which approximate the projection onto the unknown image manifold by a nearest-neighbor search against a web-scale image database containing tens of billions of images. Empirical evaluations of this defense strategy on ImageNet suggest that it is very effective in attack settings in which the adversary does not have access to the image database. We also propose two novel attack methods to break nearestneighbor defenses, and demonstrate conditions under which nearest-neighbor defense fails. We perform a series of ablation experiments, which suggest that there is a trade-off between robustness and accuracy in our defenses, that a large image database (with hundreds of millions of images) is crucial to get good performance, and that careful construction the image database is important to be robust against attacks tailored to circumvent our defenses.",Jun-19,2020/7/19 7:05,2020/7/19 7:05,2020/7/19 7:05,8759-8768,,,,,,,,,,,IEEE,"Long Beach, CA, USA",en,,,,,DOI.org (Crossref),,,,C:\Users\zhbli\Zotero\storage\MNPJYUDU\Dubey 等。 - 2019 - Defense Against Adversarial Images Using Web-Scale.pdf,,,,,,,,,,,,,,,,,,,,,,,,,,,,,,,,,,2019 IEEE/CVF Conference on Computer Vision and Pattern Recognition (CVPR),,,,,,,,,,,,,,,
QKBAQ9TW,conferencePaper,2019,"Liu, Jiayang; Zhang, Weiming; Zhang, Yiwei; Hou, Dongdong; Liu, Yujia; Zha, Hongyue; Yu, Nenghai",Detection Based Defense Against Adversarial Examples From the Steganalysis Point of View,2019 IEEE/CVF Conference on Computer Vision and Pattern Recognition (CVPR),978-1-72813-293-8,,10.1109/CVPR.2019.00496,https://ieeexplore.ieee.org/document/8953710/,"Deep Neural Networks (DNNs) have recently led to signiﬁcant improvements in many ﬁelds. However, DNNs are vulnerable to adversarial examples which are samples with imperceptible perturbations while dramatically misleading the DNNs. Moreover, adversarial examples can be used to perform an attack on various kinds of DNN based systems, even if the adversary has no access to the underlying model. Many defense methods have been proposed, such as obfuscating gradients of the networks or detecting adversarial examples. However it is proved out that these defense methods are not effective or cannot resist secondary adversarial attacks. In this paper, we point out that steganalysis can be applied to adversarial examples detection, and propose a method to enhance steganalysis features by estimating the probability of modiﬁcations caused by adversarial attacks. Experimental results show that the proposed method can accurately detect adversarial examples. Moreover, secondary adversarial attacks are hard to be directly performed to our method because our method is not based on a neural network but based on high-dimensional artiﬁcial features and Fisher Linear Discriminant ensemble.",Jun-19,2020/7/19 7:06,2020/7/19 7:06,2020/7/19 7:06,4820-4829,,,,,,,,,,,IEEE,"Long Beach, CA, USA",en,,,,,DOI.org (Crossref),,,,C:\Users\zhbli\Zotero\storage\ECHGK93I\Liu 等。 - 2019 - Detection Based Defense Against Adversarial Exampl.pdf,,,,,,,,,,,,,,,,,,,,,,,,,,,,,,,,,,2019 IEEE/CVF Conference on Computer Vision and Pattern Recognition (CVPR),,,,,,,,,,,,,,,
M4AXIRBD,conferencePaper,2019,"Dong, Jianfeng; Li, Xirong; Xu, Chaoxi; Ji, Shouling; He, Yuan; Yang, Gang; Wang, Xun",Dual Encoding for Zero-Example Video Retrieval,2019 IEEE/CVF Conference on Computer Vision and Pattern Recognition (CVPR),978-1-72813-293-8,,10.1109/CVPR.2019.00957,https://ieeexplore.ieee.org/document/8953675/,"This paper attacks the challenging problem of zeroexample video retrieval. In such a retrieval paradigm, an end user searches for unlabeled videos by ad-hoc queries described in natural language text with no visual example provided. Given videos as sequences of frames and queries as sequences of words, an effective sequence-to-sequence cross-modal matching is required. The majority of existing methods are concept based, extracting relevant concepts from queries and videos and accordingly establishing associations between the two modalities. In contrast, this paper takes a concept-free approach, proposing a dual deep encoding network that encodes videos and queries into powerful dense representations of their own. Dual encoding is conceptually simple, practically effective and endto-end. As experiments on three benchmarks, i.e. MSRVTT, TRECVID 2016 and 2017 Ad-hoc Video Search show, the proposed solution establishes a new state-of-the-art for zero-example video retrieval.",Jun-19,2020/7/19 7:08,2020/7/19 7:08,2020/7/19 7:08,9338-9347,,,,,,,,,,,IEEE,"Long Beach, CA, USA",en,,,,,DOI.org (Crossref),,,,C:\Users\zhbli\Zotero\storage\68IXQ45N\Dong 等。 - 2019 - Dual Encoding for Zero-Example Video Retrieval.pdf,,,,,,,,,,,,,,,,,,,,,,,,,,,,,,,,,,2019 IEEE/CVF Conference on Computer Vision and Pattern Recognition (CVPR),,,,,,,,,,,,,,,
6W6NT4NB,conferencePaper,2019,"Dong, Yinpeng; Su, Hang; Wu, Baoyuan; Li, Zhifeng; Liu, Wei; Zhang, Tong; Zhu, Jun",Efficient Decision-Based Black-Box Adversarial Attacks on Face Recognition,2019 IEEE/CVF Conference on Computer Vision and Pattern Recognition (CVPR),978-1-72813-293-8,,10.1109/CVPR.2019.00790,https://ieeexplore.ieee.org/document/8953400/,"Face recognition has obtained remarkable progress in recent years due to the great improvement of deep convolutional neural networks (CNNs). However, deep CNNs are vulnerable to adversarial examples, which can cause fateful consequences in real-world face recognition applications with security-sensitive purposes. Adversarial attacks are widely studied as they can identify the vulnerability of the models before they are deployed. In this paper, we evaluate the robustness of state-of-the-art face recognition models in the decision-based black-box attack setting, where the attackers have no access to the model parameters and gradients, but can only acquire hard-label predictions by sending queries to the target model. This attack setting is more practical in real-world face recognition systems. To improve the efﬁciency of previous methods, we propose an evolutionary attack algorithm, which can model the local geometry of the search directions and reduce the dimension of the search space. Extensive experiments demonstrate the effectiveness of the proposed method that induces a minimum perturbation to an input face image with fewer queries. We also apply the proposed method to attack a real-world face recognition system successfully.",Jun-19,2020/7/19 7:09,2020/7/19 7:09,2020/7/19 7:09,7706-7714,,,,,,,,,,,IEEE,"Long Beach, CA, USA",en,,,,,DOI.org (Crossref),,,,C:\Users\zhbli\Zotero\storage\9U2VR2H4\Dong 等。 - 2019 - Efficient Decision-Based Black-Box Adversarial Att.pdf,,,,,,,,,,,,,,,,,,,,,,,,,,,,,,,,,,2019 IEEE/CVF Conference on Computer Vision and Pattern Recognition (CVPR),,,,,,,,,,,,,,,
L9SDECSM,conferencePaper,2019,"Dong, Yinpeng; Pang, Tianyu; Su, Hang; Zhu, Jun",Evading Defenses to Transferable Adversarial Examples by Translation-Invariant Attacks,2019 IEEE/CVF Conference on Computer Vision and Pattern Recognition (CVPR),978-1-72813-293-8,,10.1109/CVPR.2019.00444,https://ieeexplore.ieee.org/document/8953425/,"Deep neural networks are vulnerable to adversarial examples, which can mislead classiﬁers by adding imperceptible perturbations. An intriguing property of adversarial examples is their good transferability, making black-box attacks feasible in real-world applications. Due to the threat of adversarial attacks, many methods have been proposed to improve the robustness. Several state-of-the-art defenses are shown to be robust against transferable adversarial examples. In this paper, we propose a translation-invariant attack method to generate more transferable adversarial examples against the defense models. By optimizing a perturbation over an ensemble of translated images, the generated adversarial example is less sensitive to the white-box model being attacked and has better transferability. To improve the efﬁciency of attacks, we further show that our method can be implemented by convolving the gradient at the untranslated image with a pre-deﬁned kernel. Our method is generally applicable to any gradient-based attack method. Extensive experiments on the ImageNet dataset validate the effectiveness of the proposed method. Our best attack fools eight state-of-the-art defenses at an 82% success rate on average based only on the transferability, demonstrating the insecurity of the current defense techniques.",Jun-19,2020/7/19 7:11,2020/7/19 7:11,2020/7/19 7:11,4307-4316,,,,,,,,,,,IEEE,"Long Beach, CA, USA",en,,,,,DOI.org (Crossref),,,,C:\Users\zhbli\Zotero\storage\RR32IIDX\Dong 等。 - 2019 - Evading Defenses to Transferable Adversarial Examp.pdf,,,,,,,,,,,,,,,,,,,,,,,,,,,,,,,,,,2019 IEEE/CVF Conference on Computer Vision and Pattern Recognition (CVPR),,,,,,,,,,,,,,,
